{
  "$schema": "http://json-schema.org/draft-07/schema#",
  "$id": "https://visionquest.local/config/benchmarks/result.schema.json",
  "title": "VisionQuest benchmark result",
  "description": "One suite's run, written to reports/benchmarks/latest/<suite>.json by scripts/bench/run.mjs. Validated by scripts/bench/lib/result.mjs against a hand-rolled checker covering the subset of JSON Schema used here (type, required, properties, additionalProperties, items, enum, minimum). Keep both in step.",
  "type": "object",
  "additionalProperties": false,
  "required": [
    "suite",
    "tier",
    "startedAt",
    "durationMs",
    "commit",
    "provider",
    "model",
    "host",
    "metrics",
    "status"
  ],
  "properties": {
    "suite": { "type": "string", "description": "Suite name; matches config/benchmarks/<suite>.json." },
    "tier": { "enum": ["gate", "watch", "nightly", "manual"] },
    "startedAt": { "type": "string", "description": "ISO-8601 timestamp of the run start." },
    "durationMs": { "type": "number", "minimum": 0 },
    "commit": {
      "type": ["string", "null"],
      "description": "Short commit SHA the run measured, or null outside a git checkout."
    },
    "provider": {
      "type": ["string", "null"],
      "description": "AI provider the suite exercised (gemini, ollama), or null for a deterministic suite."
    },
    "model": {
      "type": ["string", "null"],
      "description": "Exact model tag, never the provider class — the 2026-08-21 LlmCallLog lesson."
    },
    "host": {
      "type": "object",
      "additionalProperties": false,
      "required": ["os", "cpus", "memGb", "node"],
      "properties": {
        "os": { "type": "string" },
        "cpus": { "type": "integer", "minimum": 0 },
        "memGb": { "type": "number", "minimum": 0 },
        "node": { "type": "string" },
        "ollama": { "type": ["string", "null"] }
      }
    },
    "status": {
      "enum": ["pass", "watch", "fail", "info", "skipped", "error"],
      "description": "Worst metric status, or skipped/error set by the runner."
    },
    "skipped": {
      "type": "string",
      "description": "Why the suite did not run — present only when status is skipped."
    },
    "error": {
      "type": "string",
      "description": "The scorer's failure — present only when status is error."
    },
    "metrics": {
      "type": "array",
      "items": {
        "type": "object",
        "additionalProperties": false,
        "required": ["id", "value", "unit", "status"],
        "properties": {
          "id": { "type": "string" },
          "value": { "type": ["number", "null"] },
          "unit": { "enum": ["ratio", "percent", "count", "ms", "grade", "seconds"] },
          "displayUnit": {
            "type": "string",
            "description": "Free-form label the config declared (\"usd\", \"students/week\"); carried through untouched for the dashboard. `unit` stays the enum every reader formats by."
          },
          "reason": {
            "type": "string",
            "description": "Why a gate/nightly metric carries \"floor\": null — the owner-documented info case."
          },
          "direction": { "enum": ["higher", "lower"] },
          "n": { "type": ["integer", "null"], "description": "Sample size behind the value." },
          "floor": { "type": ["number", "null"] },
          "tolerance": { "type": ["number", "null"] },
          "exact": { "type": "boolean" },
          "baseline": { "type": ["number", "null"] },
          "status": { "enum": ["pass", "watch", "fail", "info", "skipped", "error"] },
          "details": {
            "type": ["object", "array", "string", "null"],
            "description": "Free-form evidence from the scorer (missed cases, offenders). Never student data."
          }
        }
      }
    }
  }
}
