{
  "suite": "explain-faithfulness-check",
  "tier": "gate",
  "startedAt": "2026-09-05T16:22:10.621Z",
  "durationMs": 31,
  "commit": "f6d7c25",
  "provider": null,
  "model": null,
  "host": {
    "os": "linux x64",
    "cpus": 4,
    "memGb": 15.7,
    "node": "v22.22.2",
    "ollama": null
  },
  "metrics": [
    {
      "id": "checker_recall",
      "value": 1,
      "unit": "ratio",
      "direction": "higher",
      "n": 30,
      "floor": 1,
      "tolerance": 0,
      "exact": true,
      "baseline": null,
      "status": "pass",
      "details": {
        "missed": [],
        "wrongByKind": {
          "wage": 7,
          "hours": 8,
          "place": 8,
          "requirement": 7
        }
      }
    },
    {
      "id": "checker_false_positives",
      "value": 0,
      "unit": "count",
      "direction": "lower",
      "n": 20,
      "floor": 0,
      "tolerance": 0,
      "exact": true,
      "baseline": null,
      "status": "pass",
      "details": {
        "falsePositives": []
      }
    },
    {
      "id": "kind_attributed",
      "value": 1,
      "unit": "ratio",
      "reason": "Informational. The gate is that a fabrication is CAUGHT; naming the right fact decides whether the student is told something useful, which is a quality of the message rather than a safety property. Flooring it would block a change that caught more fabrications while attributing one of them loosely.",
      "direction": "higher",
      "n": 30,
      "floor": null,
      "tolerance": 0.02,
      "baseline": null,
      "status": "info"
    }
  ],
  "status": "pass"
}
