{
  "suite": "explain-faithfulness",
  "tier": "nightly",
  "startedAt": "2026-10-31T11:41:37.279Z",
  "durationMs": 10746,
  "commit": "52d8dc2",
  "provider": "openrouter",
  "model": "google/gemini-3.1-flash-lite",
  "host": {
    "os": "linux x64",
    "cpus": 4,
    "memGb": 15.6,
    "node": "v24.22.1",
    "ollama": null
  },
  "metrics": [
    {
      "id": "faithful_explanations",
      "value": 1,
      "unit": "ratio",
      "direction": "higher",
      "n": 10,
      "floor": 1,
      "tolerance": 0,
      "baseline": null,
      "status": "pass",
      "details": {
        "unfaithful": []
      }
    },
    {
      "id": "median_reading_grade",
      "value": 1.8,
      "unit": "grade",
      "direction": "lower",
      "n": 10,
      "floor": 6,
      "tolerance": 0.5,
      "baseline": null,
      "status": "pass"
    },
    {
      "id": "empty_replies",
      "value": 0,
      "unit": "count",
      "direction": "lower",
      "n": 10,
      "floor": 0,
      "tolerance": 0,
      "baseline": null,
      "status": "pass"
    }
  ],
  "status": "pass"
}
