{
  "suite": "hard-blocks",
  "tier": "gate",
  "startedAt": "2026-09-05T17:07:02.500Z",
  "durationMs": 231,
  "commit": "cfde387",
  "provider": null,
  "model": null,
  "host": {
    "os": "linux x64",
    "cpus": 4,
    "memGb": 15.7,
    "node": "v22.22.2",
    "ollama": null
  },
  "metrics": [
    {
      "id": "blocks_expected_fired",
      "value": 1,
      "unit": "ratio",
      "direction": "higher",
      "n": 1693,
      "floor": 1,
      "tolerance": 0,
      "exact": true,
      "baseline": null,
      "status": "pass",
      "details": {
        "missed": [],
        "codesExercised": [
          "availability_no_overlap",
          "employer_do_not_contact",
          "lead_not_open",
          "missing_must_have_cert",
          "pay_below_floor",
          "student_withdrew_from_employer",
          "transport_infeasible"
        ],
        "unexercised": []
      }
    },
    {
      "id": "false_blocks",
      "value": 0,
      "unit": "count",
      "direction": "lower",
      "n": 2000,
      "floor": 0,
      "tolerance": 0,
      "exact": true,
      "baseline": null,
      "status": "pass",
      "details": {
        "falseBlocks": [],
        "unexercised": []
      }
    }
  ],
  "status": "pass"
}
