{
  "suite": "page-timing",
  "tier": "watch",
  "startedAt": "2026-10-17T10:09:11.104Z",
  "durationMs": 0,
  "commit": "ddb47c0",
  "provider": null,
  "model": null,
  "host": {
    "os": "linux x64",
    "cpus": 4,
    "memGb": 15.6,
    "node": "v24.21.0",
    "ollama": null
  },
  "metrics": [
    {
      "id": "p95_ttfb_ms_dashboard",
      "value": null,
      "unit": "ms",
      "direction": "lower",
      "status": "skipped"
    },
    {
      "id": "p95_dcl_ms_dashboard",
      "value": null,
      "unit": "ms",
      "direction": "lower",
      "status": "skipped"
    },
    {
      "id": "p95_ttfb_ms_career",
      "value": null,
      "unit": "ms",
      "direction": "lower",
      "status": "skipped"
    },
    {
      "id": "p95_dcl_ms_career",
      "value": null,
      "unit": "ms",
      "direction": "lower",
      "status": "skipped"
    },
    {
      "id": "p95_ttfb_ms_teacher",
      "value": null,
      "unit": "ms",
      "direction": "lower",
      "status": "skipped"
    },
    {
      "id": "p95_dcl_ms_teacher",
      "value": null,
      "unit": "ms",
      "direction": "lower",
      "status": "skipped"
    },
    {
      "id": "p95_ttfb_ms_teacher_connect",
      "value": null,
      "unit": "ms",
      "direction": "lower",
      "status": "skipped"
    },
    {
      "id": "p95_dcl_ms_teacher_connect",
      "value": null,
      "unit": "ms",
      "direction": "lower",
      "status": "skipped"
    }
  ],
  "status": "skipped",
  "skipped": "requires browser (PLAYWRIGHT is not set); requires server (BENCH_BASE_URL is not set)"
}
