{
  "suite": "connect-journey",
  "tier": "gate",
  "startedAt": "2026-09-05T16:33:56.879Z",
  "durationMs": 11,
  "commit": "f6d7c25",
  "provider": null,
  "model": null,
  "host": {
    "os": "linux x64",
    "cpus": 4,
    "memGb": 15.7,
    "node": "v22.22.2",
    "ollama": null
  },
  "metrics": [
    {
      "id": "completed",
      "value": 1,
      "unit": "count",
      "direction": "higher",
      "n": 1,
      "floor": 1,
      "tolerance": 0,
      "exact": true,
      "baseline": null,
      "status": "pass",
      "details": {
        "connectionId": "cmtolqgiz00027dyvoepyheew",
        "measuredAt": "2026-09-05T16:33:47.520Z",
        "ageHours": 0
      }
    },
    {
      "id": "student_taps",
      "value": 2,
      "unit": "count",
      "direction": "lower",
      "n": 1,
      "floor": 12,
      "tolerance": 0,
      "baseline": null,
      "status": "pass",
      "details": {
        "note": "studentTaps counts only what the STUDENT does. The instructor's and the employer's steps are real work by other people and are not what the design's 12-tap floor is about."
      }
    },
    {
      "id": "elapsed_ms",
      "value": 39451,
      "unit": "ms",
      "reason": "Wall clock including database polling and Playwright's own waits, on whatever machine ran it. A trend line across runs on one machine, never a latency number — flooring it would fail a slow CI runner and teach everyone to ignore the gate.",
      "direction": "lower",
      "n": 1,
      "floor": null,
      "tolerance": 0,
      "baseline": null,
      "status": "info"
    }
  ],
  "status": "pass"
}
