{
  "suite": "sage-grounding",
  "tier": "nightly",
  "startedAt": "2026-10-31T11:41:48.026Z",
  "durationMs": 8119,
  "commit": "52d8dc2",
  "provider": null,
  "model": null,
  "host": {
    "os": "linux x64",
    "cpus": 4,
    "memGb": 15.6,
    "node": "v24.22.1",
    "ollama": null
  },
  "metrics": [
    {
      "id": "pass_rate",
      "value": 1,
      "unit": "ratio",
      "direction": "higher",
      "n": 3,
      "floor": 1,
      "tolerance": 0,
      "baseline": null,
      "status": "pass",
      "details": {
        "failing": []
      }
    }
  ],
  "status": "pass"
}
