{
  "suite": "example-smoke",
  "tier": "watch",
  "startedAt": "2026-10-31T11:42:04.235Z",
  "durationMs": 2,
  "commit": "52d8dc2",
  "provider": null,
  "model": null,
  "host": {
    "os": "linux x64",
    "cpus": 4,
    "memGb": 15.6,
    "node": "v24.22.1",
    "ollama": null
  },
  "metrics": [
    {
      "id": "accuracy",
      "value": 1,
      "unit": "ratio",
      "direction": "higher",
      "n": 10,
      "floor": 1,
      "tolerance": 0,
      "baseline": null,
      "status": "pass",
      "details": {
        "failures": []
      }
    }
  ],
  "status": "pass"
}
