{
  "suite": "sage-latency",
  "tier": "nightly",
  "startedAt": "2026-10-24T10:17:52.720Z",
  "durationMs": 0,
  "commit": "9c414f4",
  "provider": null,
  "model": null,
  "host": {
    "os": "linux x64",
    "cpus": 4,
    "memGb": 15.6,
    "node": "v24.21.0",
    "ollama": null
  },
  "metrics": [
    {
      "id": "p95_ms",
      "value": null,
      "unit": "ms",
      "direction": "lower",
      "status": "skipped"
    },
    {
      "id": "p50_ms",
      "value": null,
      "unit": "ms",
      "reason": "informational alongside the gated p95_ms — config/sage-slo.json only publishes a p95 bar for sage_chat.gemini, and p50 exists purely for trend/debugging context",
      "direction": "lower",
      "status": "skipped"
    }
  ],
  "status": "skipped",
  "skipped": "requires gemini (GEMINI_API_KEY is not set)"
}
