{
  "suite": "orientation-readiness",
  "tier": "gate",
  "startedAt": "2026-09-05T17:01:33.615Z",
  "durationMs": 70,
  "commit": "b579cdb",
  "provider": null,
  "model": null,
  "host": {
    "os": "linux x64",
    "cpus": 4,
    "memGb": 15.7,
    "node": "v22.22.2",
    "ollama": null
  },
  "metrics": [
    {
      "id": "consumer_disagreements",
      "value": 116,
      "unit": "count",
      "reason": "Nonzero today, and closing it changes what three surfaces show every teacher — a product call, not a build one. The teacher roster passes no orientationProgress, so partial orientation earns 0 of 10 there; the class-progress panel and the KPI report read certifications, portfolio, resume and shared-page facts only out of the stored Progression.state, never reconciled against live rows. Recorded and watched until those two mappings are settled, then floored at 0 (design section 4.6: 'identical score across surfaces'). Same shape as axe-authenticated's burn-down: measure first, then gate.",
      "direction": "lower",
      "n": 300,
      "floor": null,
      "tolerance": 0,
      "baseline": null,
      "status": "info",
      "details": {
        "reference": "student_dashboard",
        "bySurface": {
          "teacher_roster": 50,
          "class_progress": 33,
          "kpi_report": 33
        },
        "mappings": {
          "student_dashboard": "reconciled",
          "student_journey_strip": "reconciled",
          "teacher_student_profile": "reconciled",
          "intervention_queue": "reconciled",
          "class_progress": "progression_state",
          "kpi_report": "progression_state",
          "teacher_roster": "roster"
        },
        "worstExamples": [
          {
            "drift": "stale",
            "orientationCompleted": 4,
            "worstGap": 23,
            "scores": {
              "student_dashboard": 16,
              "student_journey_strip": 16,
              "teacher_student_profile": 16,
              "intervention_queue": 16,
              "class_progress": 13,
              "kpi_report": 13,
              "teacher_roster": 39
            }
          },
          {
            "drift": "stale",
            "orientationCompleted": 12,
            "worstGap": 21,
            "scores": {
              "student_dashboard": 37,
              "student_journey_strip": 37,
              "teacher_student_profile": 37,
              "intervention_queue": 37,
              "class_progress": 16,
              "kpi_report": 16,
              "teacher_roster": 53
            }
          },
          {
            "drift": "stale",
            "orientationCompleted": 3,
            "worstGap": 20,
            "scores": {
              "student_dashboard": 18,
              "student_journey_strip": 18,
              "teacher_student_profile": 18,
              "intervention_queue": 18,
              "class_progress": 9,
              "kpi_report": 9,
              "teacher_roster": 38
            }
          },
          {
            "drift": "stale",
            "orientationCompleted": 2,
            "worstGap": 20,
            "scores": {
              "student_dashboard": 45,
              "student_journey_strip": 45,
              "teacher_student_profile": 45,
              "intervention_queue": 45,
              "class_progress": 32,
              "kpi_report": 32,
              "teacher_roster": 65
            }
          },
          {
            "drift": "stale",
            "orientationCompleted": 1,
            "worstGap": 20,
            "scores": {
              "student_dashboard": 38,
              "student_journey_strip": 38,
              "teacher_student_profile": 38,
              "intervention_queue": 38,
              "class_progress": 27,
              "kpi_report": 27,
              "teacher_roster": 58
            }
          }
        ]
      }
    },
    {
      "id": "denominator_is_all_items",
      "value": 1,
      "unit": "count",
      "direction": "higher",
      "n": 5,
      "floor": 1,
      "tolerance": 0,
      "baseline": null,
      "status": "pass",
      "details": {
        "checked": [
          "src/lib/progression/fetch-readiness-data.ts",
          "src/lib/class-progress.ts",
          "src/lib/teacher/dashboard.ts",
          "src/app/api/teacher/reports/academic-kpi/route.ts",
          "src/app/api/teacher/students/[id]/route.ts"
        ],
        "offenders": []
      }
    },
    {
      "id": "score_decreases_on_completion",
      "value": 0,
      "unit": "count",
      "direction": "lower",
      "n": 4200,
      "floor": 0,
      "tolerance": 0,
      "baseline": null,
      "status": "pass",
      "details": {
        "examples": []
      }
    }
  ],
  "status": "pass"
}
